,Doc ID,Parent ID,Custodian,Ori File Folder,Ori File Name,S - Created Date,S - Modified Date,Sent Date,From,From SMTP,To,To SMTP,CC,CC SMTP,BCC,BCC SMTP,Last Author,Author/Sender,Content,TxT File Path
	B 1.20	Management & Organization	Management Structure & Organization	Basic Bonus		Used Car Manager & Purchasing Manager	Used Car Manager & Purchasing Manager	Each dealership must assign full-time Used Car Manager & Purchase Manager separately responsible for Mercedes-Benz Used Car business.	각 딜러십(전시장)는 메르세데스-벤츠 중고차 사업을 위해 공식적으로 임명한 풀타임 Used Car Manager와 Purchasing Manager를 각각 두어야 한다.	MPC	Sales	Sales_F&U	Sung-Min Kim	
					I	Appointments to Used Car Manager & Purchasing Manager	Used Car Manager 및 Purchasing Manager의 선임	New appointments to Used Car manager & Purchasing manager are informed to Mercedes-Benz Korea. If required, MBK can request an assessment process such as interview and Dealer participates in the process actively. Both Used Car manager and Purchasing manager must meet eligibility.	Used Car Manager 및 Purchasing Manager의 선임은 MBK에게 사전 고지되어야 한다. 합리적으로 필요한 경우, MBK 는 인터뷰 등의 심사절차의 진행을 요청할 수 있으며 딜러는 이에 적극적으로 부응한다.Used Car Manager와 Purchasing Manager는 모두 MBK 에서 배포한 자격요건에 맞아야 한다.			Sales_F&U	Sung-Min Kim	
	B 1.22	CPO Sales	Sales Process
CPO Sales 	Basic Bonus		Sales Monitoring & Report	세일즈 모니터링 및 리포트	The dealer sets targets and regularly monitors performance of each salesperson. Appropriate action should be taken by the management in order to meet cpo sales objectives.	딜러는 개별 (또는 팀별) 판매 목표량을 정하고 각 영업사원의 성과를 정기적으로 살핀다. 인증중고차 판매 목표를 달성하기 위해 관리부는 적절한 조치를 취해야 한다.	MPC	Sales	Sales_F&U	Sung-Min Kim	
					I-a	Sales performance records	세일즈 퍼포먼스 기록	Actual records (Monthly Closing Report) must be provided to responsible cpo manager including monthly qualified trade-in / conquest results.	딜러는 담당 cpo manager에게 월 단위로 monthly closing report를 제출하며, 여기에는 조건에 부합하는 trade-in / non-MB Trade-in 결과와 매입배율 관리에 대한 현황이 포함되어야 한다.			Sales_F&U	Sung-Min Kim	
16.0					I-b	Non-conformance	불만족 시	In case of non-conformance, a prior agreement with Mercedes-Benz Korea is required.	만족되지 않을 시, Mercedes-Benz 와 사전 협의를 거쳐야 한다.			Sales_F&U	Sung-Min Kim	
	B 1.3	Management & Organization	Management Structure & Organization	Basic Bonus		Retail HR Database Management	임직원 현황표 관리	The Dealership‘s organization and functions with corresponding responsibilities are documented in an organization chart and are accessible for everyone in the Dealership.	딜러 조직도에 각 직무별 기능 및 책임 분야가 정리되어 있어야 하며 모든 직원들이 쉽게 접근할 수 있다. 	MPC	Overall	ND_DD	Aaron Park	
					I	Names and Functions of Staff 	임직원 현황표	Organization chart covers all positions (including at least management level, productive employees, service advisors) and all staff's names are associated with each function.	딜러 조직도 및 임직원 현황표는 최소한 관리자, 직접 작업자 및 서비스 어드바이저등을 포함한 모든 직급을 포함하여야 하고 모든 직원의 이름에 각자의 담당업무가 포함되어야 한다.			ND_DD	Aaron Park	
					II	Organization Chart Information	조직도의 내용	The Dealer shall follow the guideline provided by MBK and fill in the most accurate and latest information including new hire/resignation/internal rotation.	딜러사는 MBK에서 배포한 임직원 현황표 및 조직도 가이드라인을 준수하여, 신규입사/퇴사/보직이동 등과 관련된 최신의 정보를 정확히 기입하여야 한다. 			ND_DD	Aaron Park	
					III	Update of organization chart	조직도 업데이트	The company's Organization Chart and employee directory shall be uploaded and maintained in BENEFIT every month within working day 5 days by MBK with the up-to-date information. The information complies with guideline and template which is provided by MBK.	딜러 조직도 및 임직원 현황표는 전월 기준으로 MBK가 제공하는 가이드라인과 템플렛에 따라 익월 제5영업일 내에 BENEFIT을 통해 업로드되고 관리되어야 하며, 최신 정보여야 한다. 			ND_DD	Aaron Park	
					IV	Accuracy	조직도의 정확성	Retail HR data should be accurate. In case, the Dealer in need of revising uploaded information, MBK can request for additional submission or correction. The dealer shall submit additionally requested information within 3 working days from the requested date.	업로드된 임직원 현황표 정보는 정확해야한다. 업로드 된 자료의 정정이 필요한 경우, MBK는 추가 제출을 요구할 수 있다. 추가 제출 요청을 받을시, 요청시점으로 부터 제 3영업일 내에 정정, 재제출 해야 한다. 			ND_DD	Aaron Park	
	B 2.10	Management & Organization	Business Management & Controlling	Basic Bonus		Fidelity obligation	충실도의 임무	Dealers is obligated to follow policy defined by Mercedes-Benz Korea in dealer contract, retail policy, guideline and direction notified to dealers through written document and official letter including e-mail.	딜러는 서면 또는 공문 (이메일 포함)을 통해 배포된 Mercedes-Benz Korea와의 딜러 계약서(Dealer Agreement)과 소매 영업 정책 (Retail Policy) 및 각종  가이드라인과 지침에 대해 성실히 이행하여야 한다.	MPC	Overall	ND_BM	Sora Kim	
17.0					I	Warning letter	경고장	Warning letter approved by network development and department head or above of requesting department has not been sent to dealership two times or more per year due to violation of any policy defined by Mercedes-Benz Korea .	Mercedes-Benz Korea  규정사항을 위반하여 Mercedes-Benz Korea 해당부서의 부사장 급 이상과 네트워크 개발부의 승인을 득한 경고 공문이 년 2회 이상 발송된 경우 미충족 처리한다.			ND_BM	Sora Kim	
	B 2.1	Management & Organization	Business Management & Controlling	Must		Accounting System	회계 시스템	The dealer operates with a designated accounting software (DMS) based on Korea International Financial Reporting Standard (K-IFRS) or Korea Generally Accepted Accounting Principles (K-GAAP).	딜러의 회계는 지정된 회계 소프트웨어(DMS)를 사용하며, 회계 기준은 한국채택국제회계기준(K-IFRS) 또는 일반기업회계기준(K-GAAP)으로 한다.	MPC	Overall	ND_BM	Sora Kim	
					I	Accounting supported by accounting software	회계 소프트웨어 기반의 회계 관리	The dealer operates with DMS accounting module in principle, based on the Korea International Financial Reporting Standard (K-IFRS) or Korea Generally Accepted Accounting Principles (K-GAAP).	딜러사는 DMS를 회계 시스템으로 사용하는 것이 원칙이며, 회계 처리 기준은 한국채택국제회계기준(K-IFRS) 또는 일반기업회계기준(K-GAAP)으로 한다.			ND_BM	Sora Kim	
					II-a	Integrated accounting system	통합 회계 시스템	The accounting system is integrated in DMS or has a suitable interface to DMS.
	회계시스템은 DMS에 통합되거나 DMS와 호환되어야 한다.			ND_BM	Sora Kim	
19.0					II-b	Non-conformance	불만족 시	In case of non-conformance, prior written MBK approval exists.	만족되지 않을 시 Mercedes-Benz Korea 의 문서상 사전 승인을 득하여야 한다. 			ND_BM	Sora Kim	
	B 2.2	Management & Organization	Business Management & Controlling	Must		Format of Reporting Data	보고자료의 형식	The reporting data as defined in the MB Dealer Reporting Structure is provided electronically (e.g. via Internet) in an adequate interfacing format defined by MBK.	MB 딜러 보고 구조에 맞는 보고자료는 MBK에서 정의하는 시스템 인터페이스에 부합하는 형식으로 제출된다.	MPC	Overall	ND_BM	Sora Kim	
					I-a	Integrated accounting system	통합 회계 시스템	Kerridge Autoline DMS linked to MBK DMS server is in place and in use for daily operation. 	MBK DMS server 에 연결된 Kerridge Autoline DMS 가 설치되어 일일 업무에 사용되고 있다. 			ND_BM	Sora Kim	
					I-b	Non-conformance	불만족 시	In case of non-conformance prior written approval by MBK exists. 	만족하지 않을 시 Mercedes-Benz Korea의 문서상 사전 승인을 득하여야 한다. 			ND_BM	Sora Kim	
					II-a	Input data via DMS	DMS를 통한 데이터 입력	The Dealership has an automatic interface in the DMS and provides input date in Dealer Reporting Structure defined by Mercedes-Benz Korea. 	딜러는 DMS 에 연결되어 있고, Mercedes-Benz Korea 에서 요구하는 딜러 보고구조에서 정의하는 입력정보를 모두 입력한다. 			ND_BM	Sora Kim	
					II-b	Non-conformance	불만족 시	In case of non-conformance prior written approval by MBK exists. 	만족하지 않을 시 Mercedes-Benz Korea 의 문서상 사전 승인을 득하여야 한다. 			ND_BM	Sora Kim	
					III-a	Accounting System with DMS	DMS를 통한 회계 시스템 관리	DMS accounting module is used and Dealership provides data through DMS.	딜러는 DMS 회계 모듈을 사용하여야 하며, DMS 시스템을 통해 자료를 제출한다.			ND_BM	Sora Kim	
20.0					III-b	If not available	불가능할 시	If such set-up of automated data transfer is not available, or the financial data of DMS module does not fit for Mercedes-Benz Korea's requirements, Dealer shall submit such information with designated format to Mercedes-Benz Korea. 	DMS와의 연결이 안되어 있거나, 혹은 연결은 되어 있으나 DMS 상의 정보가 Mercedes-Benz Korea에서 요구하는 정보에 부합하지 않을 경우, 딜러는 해당 자료를 지정된 양식으로 Mercedes-Benz Korea로 제출하여야 한다.			ND_BM	Sora Kim	
	B 2.3	Management & Organization	Business Management & Controlling	Must		Statutory Financial Statement	연간회계감사자료	The statutory balance sheet and the income statement relating to the brand is submitted to MBK.	연간회계감사자료가 MBK에 제출되어야 한다. 	MPC	Overall	ND_BM	Sora Kim	
					I	Financial statement	재무 제표	The statutory financial statement of the contract partners is available at MBK within 120 days after each fiscal year.	연간회계감사자료가 회계년도 후 120일 이내에 Mercedes-Benz Korea 에 제출되어야 한다. 			ND_BM	Sora Kim	
21.0					II	Financial & operating income statement	재정 및 경상비 손익 계산서	Dealer provides the relevant data for the credit audit under MBK guideline upon the request from MBK.	딜러사는 MBK의 요구가 있을 시 연간 신용평가에 필요한 자료를 제공한다. 			ND_BM	Sora Kim	
	B 2.4	Management & Organization	Business Management & Controlling	Basic Bonus		DMS Maintenance	DMS 관리	Dealer shall assign the responsible personnel for each module and manage the system in conformity with the standard guideline for proper usage of DMS.	딜러는 DMS의 올바른 사용을 위해 담당자를 지정하고 기준에 맞게 관리한다.	MPC	Overall	ND_BM	Sora Kim	
					I	Standard Chart of Account	회계 관련 표준 차트	The dealer operates with DMS accounting module based on the Standard Chart of Account(COA) provided by MBK.	딜러사의 DMS 상 회계 모듈 사용은 MBK가 규정한 표준회계계정 (CoA)에 따른다. 			ND_BM	Sora Kim	
					II-a	Monthly closing of DMS accounting module	DMS 회계모듈의 월마감	Closing of DMS accounting module shall be completed within the specific timeframe defined by MBK.	DMS 회계모듈의 월마감은 MBK가 정의한 기한 내에 완료한다. 			ND_BM	Sora Kim	
					II-b	Non-conformance	불만족 시	In case of non-conformance a prior written approval of Mercedes-Benz Korea Ltd. exits.	만족하지 않을 시 Mercedes-Benz Korea의 문서상 사전 승인을 득하여야 한다.			ND_BM	Sora Kim	
					lll-a	Process owner for each DMS module assigned 	모듈 별 별도의 담장자 임명	Dealer shall designate the responsible person for each DMS module for proper maintenance of DMS data, and the designated person for each module shall be named in employee directory and organization chart, respectively.	DMS 데이터의 적절한 관리를 위하여 딜러는 각 DMS 모듈 별 별도의 담당자를 지정하여야 하며, 이를 임직원 현황표 및 조직도에 반영하여야 한다.			ND_BM	Sora Kim	
					lll-b	Process owner for each DMS module trained	모듈 별 담당자의 교육	The responsible person of each module shall actively attend the relevant training offered by MBK and obtain evaluation result at a certain level.	각 모듈 별 담당자는 MBK가 제공하는 관련 교육에 충실히 참여하여야 하며, 일정 수준의 평가 결과를 득한다.			ND_BM	Sora Kim	
	B 4.01	Management & Organization	IT Facilities & Operations	Basic Bonus		Connectivity for IT system	IT 시스템을 위한 연결성	The IT systems of the dealership fulfil the brand requirements and are linked to that of the MBK (where necessary) to assure required connectivity (transmission), as well as the accuracy and timeliness of the database content.

	딜러쉽의 IT 시스템은 브랜드 요구를 중족해야하며 데이터 배이스 컨탠츠가 정확하게, 시간제약 없이 통신 될 수 있어야 한다.	MPC	Overall	ND_DD	Aaron Park	
					I	Connection	연결	IT system of the dealership is linked to DMS of MBK 	딜러쉽의 IT 시스템은 DMS 에 연결되어 있어야한다.			ND_DD	Aaron Park	
					II	Wi-Fi	와이파이 	Wi-Fi connection available  Incl. guest wi-fi for customers	고객용을 포함한 Wi-Fi 연결이 가능해야 한다.			ND_DD	Aaron Park	
24.0					III	Maintanence of Digital elements	Digital 요소 관리	The digital elements are working well:
- MPS II: Digital Signage, Digital Kiosk

- MAR 2020(Including Scala Software):
Display area : Stage wall 
Consulting area : Digital signage with mirroring function
Consulting room : Digital signage, brand signage
Vehicle handover : Digital signage, recommended sound system	매장에 비치된 Digital 요소들의 관리가 잘 이루어지고 있다. 
- MPS II: Digital Signage, Digital Kiosk

- MAR 2020(Scala 포함):
Display area : Stage wall 
Consulting area : Digital signage with mirroring function
Consulting room : Digital signage, brand signage
Vehicle handover : Digital signage, recommended sound system			ND_DD	Aaron Park	
	C 1.1	Personnel & Training	Human Resources Management	Must		Sales Staff Qualification	전시장 임직원 자격 요건	Mercedes-Benz Retail Sales staff should participate qualification and certification program of Mercedes-Benz Korea Training Academy.	Mercedes-Benz 차량 판매에 종사하는 임직원은 Mercedes-Benz Korea Training Academy에서 주관하는 교육 및 인증 프로그램에 참가한다.	MPC	Sales	Training	Jennifer Kim	
					I-a	New Car Sales Staff	신차 전시장 임직원	1) All Sales Consultants in Showroom should participate in C-Sales training at Mercedes-Benz Korea Training Academy as guided by ""Retail Career Management Program"" and complete its certification process within 12 months after the training.
2) All Sales Receptionists & Product Experts in Showroom should participate in relevant training at Mercedes-Benz Training Academy as guided by ""Retail Career Management Program"".	1) 전시장의 모든 영업 직원은 입사 후 ""Retail Career Management Program""의 가이드에 따라  Mercedes-Benz Korea Training Academy가 주관하는 직무인증교육(C-Sales)에 참가하고, 교육 이수 후 12개월 이내에 C-Sales 최종 인증절차를 거치도록 한다.
2) 전시장의 모든 리셉셔니스트 및 프로덕트 엑스퍼트는 입사 후 ""Retail Career Management Program""의 가이드에 따라 Mercedes-Benz Korea Training Academy가 주관하는 직무교육에 참가한다. 			Training	Jennifer Kim	
25.0					I-b	Used Car Sales Staff	중고차 전시장 임직원	All Used Car Sale Consultants & Purchasing Staff in Used Car showroom should participate in relevant training at Mercedes-Benz Korea Training Academy as guided by ""Retail Career Management Program"".	중고차 전시장의 모든 영업 직원 및 매입 담당자는 입사 후 ""Retail Career Management Program""의 가이드에 따라  Mercedes-Benz Korea Training Academy가 주관하는 직무교육에 참가한다.			Training	Jennifer Kim	
	C 1.2	Personnel & Training	Human Resources Management	Must		Customer Services Staff Qualification	고객서비스 직원 자격 요건	Mercedes-Benz retail Customer Services staff should participate qualification and certification program of Mercedes-Benz Korea Training Academy.	Mercedes-Benz 차량 고객서비스에 종사하는 임직원은 Mercedes-Benz Korea Training Academy에서 주관하는 교육 및 인증 프로그램에 참가한다.	MPC	Customer Service	Training	Jennifer Kim	
					I-a	Customer Services Staff	서비스센터 임직원	1) All employees in Service Center should participate in training at MBK Training Academy as guided by ""Retail Career Management Program"".
2) Relevant Service employees are as follows.
- General repair technician (QMT/QST/CDT)
- Service Advisor (QSA/CSA)
- Parts Process Specialist (QPPS)
- Parts & Accessories Specialist (CPAS)
- Body technician (QBT/QBS)
- Paint technician (QPS)
- Service Receptionist
- CCCa	1) 서비스센터의 모든 직원은 ""Retail Career Management Program""의 가이드에 따라  Mercedes-Benz Korea Training Academy가 주관하는 직무인증교육에 참가한다.
2) 해당이 되는 주요 직원 (해당 직무인증)은 아래와 같다.
- 일반수리 직원 (QMT/QST/CDT)
- 서비스 어드바이저 (QSA/CSA)
- 부품관리 직원 (QPPS)
- 부품 및 액세서리 판매 직원 (CPAS)
- 차체수리 직원 (QBT/QBS)
- 도장 직원 (QPS)
- 서비스 리셉셔니스트
- CCCa			Training	Jennifer Kim	
					I-b	High Voltage Specialist	서비스센터 고전압 전문가	All Service Center should have at least 1 (one) High Voltage Specialist (Level 3).
Relevant High Voltage Specialist should participate in HV qualification training at Mercedes-Benz Korea Training Academy.	모든 서비스센터는 1명 이상의 고전압 전문가(레벨3)를 보유해야 한다.
해당 고전압 전문가(레벨3)는 ""Retail Career Management Program""의 가이드에 따라 Mercedes-Benz Korea Training Academy가 주관하는 고전압 직무인증교육에 참가한다.			Training	Jennifer Kim	
					I-c	Non-conformance	불만족 시	In case of non-conformance, a prior agreement with Mercedes-Benz Korea Training Academy is required.	만족되지 않을 시, Mercedes-Benz Training Academy와 사전 협의를 거쳐야 한다.			Training	Jennifer Kim	
	C 2.01	Personnel & Training	Training & Qualifications	Basic Bonus		Retail Career Management Program
(RCMP)	딜러 임직원 경력개발 프로그램 (RCMP)	Dealer should actively participate in RCMP (Retail Career Management Program) which is provided by Mercedes-Benz Korea Training Academy to focus on dealer employees' development.	딜러는 Mercedes-Benz Korea Training Academy에서 주관하는 RCMP (Retail Career Management Program)에 적극 참여하여 임직원의 경력 및 역량개발에 집중한다.	MPC	Overall	Training	Jennifer Kim	
					I	RCMP - Planning	RCMP 계획 수립	Dealer management & learning coordinators should cooperate with Mercedes-Benz Korea Training Academy for dealer employees' individual development plan and reflect to ""Retail Career Management Program""	딜러 임직원의 관리자 및 교육 담당자는 Mercedes-Benz Korea Training Academy와 협력하여 임직원 개별 역량개발(교육) 계획을 수립하고, ""Retail Career Management Program""에 반영한다.
			Training	Jennifer Kim	
31.0					II	RCMP - Individual development & qualification	임직원 개인 역량개발 및 자격 부여	1) All dealer employees should participate in training at Mercedes-Benz Training Academy as guided by ""Retail Career Management Program"", not limited to F2F training but includes online training & assessment.
2) All dealer employees' individual development and level of qualification is measured under ""Retail Career Management Prorgram"".
3) All dealer employees' should participate in online training provided by Mercedes-Benz Korea Training Academy with defined authentication (individual GEMS ID).	1) 모든 딜러 임직원은 ""Retail Career Management Program""의 가이드에 따라 Mercedes-Benz Korea Training Academy에서 지정한 교육에 참여해야 하며, 이는 단지 대면 교육 및 평가에 국한되지 않으며 기타 온라인 교육 및 평가를 포함한다.
2) 각 임직원은 ""Retail Career Management Program""을 통해 개인의 역량개발 및 자격이 평가된다.
3) 각 임직원은 개별 인증 절차를 통해 (개별 GEMS ID), Mercedes-Benz Korea Training Academy에서 지정한 온라인교육에 참여해야 한다.			Training	Jennifer Kim	
	C 2.6	Personnel & Training	Training & Qualifications	Basic Bonus		Learning Coordinator	Learning Coordinator	Dealer should have designated staff to coordinate and control all training activities and to manage the training records of the employees. The necessary data or/and qualification level of target group should be provided to Mercedes-Benz Korea.	딜러는 모든 교육활동을 조정, 관리하고 직원 교육기록을 관리하는 전담직원이 있어야 한다. 대상집단의 필요자료와 자격수준은 Mercedes-Benz Korea에 제공되어야 한다.	Site	Overall	Training	Jennifer Kim	
					I	Coordination and Controlling of Training Activities	트레이닝 활동 조정 및 관리	Dealer should have designated staff (described in organization chart) to coordinate and control training activities and taking his/her role substantially.	딜러는 모든 교육관련 활동을 조정, 관리하는 전담직원이 있으며(임직원현황표에 반영), 관련된 역할을 실질적으로 수행해야 한다.			Training	Jennifer Kim	
	D 1.2	Marketing	Marketing Planning	Awarded Bonus		Retail Marketing	리테일 마케팅	Retail campaign and retail marketing activities should comply with Brand CI/CD and the related marketing guideline. 	딜러사의 모든 마케팅 활동은 MBK에서 제공하는 Brand CI/CD 및 마케팅 가이드를 준수하여 시행한다.	MPC	Sales	P&M_Retail Marketing	Jaekyung Park	
35.0					I	Brand Marketing Guideline	브랜드 마케팅 가이드라인	All marketing campaign names, representative images, and communication messages carried out by dealer companies should follow Daimler guidelines. (all new car /used car marketing activities including sub-brand communications  such as AMG, EQ, MAYBACH, She’s Mercedes, Mercedes Me “Family”)	딜러사가 진행하는 모든 마케팅 요소(e.g. 캠페인 명, 대표 이미지, 캠페인 메시지 등)는 본사 가이드라인에 맞추어 시행되어야 한다. (AMG, EQ, MAYBACH,  She’s Mercedes, Mercedes Me “Family"" 등 서브 브랜드 활동, 모든 신차/중고차 마케팅 포함)			P&M_Retail Marketing	Jaekyung Park	
	D 2.12	Marketing	CRM	Basic Bonus		Corporate Standards in Compliance with Law	법규를 준수하는 범위 내에서의 회사 내규	The dealer complies with and respects corporate standard and national laws with regards to data protection.	딜러는 데이터보호에 관련한 사내 기준과 국내법을 준수하고 존중한다.	Back Office	Overall	Digital House	Lauren Suh	
					I	Responsible personnel for CRM	CRM 책임 담당자	At least one person is responsible for CRM between Mercedes-Benz Korea and dealership, and is indicated in the organization chart. 
	최소한 한 사람은 딜러와 Mercedes-Benz Korea 사이의 CRM을 위한 책임자로 있어야 하며 조직도에 반영된다.			Digital House	Lauren Suh	
38.0					II	Customer Provision	고객 관련 규정	Customers' consent to the collection and use of personal information should be obtained via legally compliant form in pursuant to the Korean law of personal data protection.  All mandatory consents must be checked and agreed. 	고객의 개인정보 수집,이용,위탁,제공에 대한 동의를 국내법규에 맞는 '개인정보활용 동의서'를 통하여 득한다. 필수 동의항목은 반드시 동의받는다.			Digital House	Lauren Suh	
	D 2.9	Marketing	CRM	Basic Bonus		After-Sales Follow Up	After-Sales 사후 관리 	The dealership follows MBK guideline for customer contact after new car sales	딜러는 신차 판매 이후 MBK의 가이드라인에 따라 고객연락을 취한다.	MPC	Customer Service	CS Marketing	Eunjeong Lee	
					I-a	After-Sales Promotional Activities	After-Sales 홍보 활동	The dealership sends DM or SMS/MMS to their After-Sales customers with the customer information exported from Salesforce.com

1) Send out the integrated (both Compact plus package and Warranty plus) DM or SMS/MMS to those who are within 3 month from ISP expiration.

2) Send out the ‘Regular Maintenance Service’ DM or SMS/MMS every 10 months from the last maintenance service targeting the customers out of ISP without Compact plus package.

	딜러는 Salesforce.com 시스템을 이용하여 다음의 고객 정보를 추출하여 DM 또는 SMS/MMS를 발송한다.

