,Doc ID,Parent ID,Custodian,Ori File Folder,Ori File Name,S - Created Date,S - Modified Date,Sent Date,From,From SMTP,To,To SMTP,CC,CC SMTP,BCC,BCC SMTP,Last Author,Author/Sender,Content,TxT File Path
							IV	24Hr emergency call number	24시간 긴급 출동 서비스	Phone number of MB 24Hr emergency call has to be included in open hour board and 24Hr Dealer Roadside Assistance contact number can be added optionally.	영업시간 안내판에 MBK의 24시간 출동 서비스 전화번호가 표시되어야 있어야 하며 딜러의 24시간 출동 서비스 직통번호는 선택적으로 표시할 수 있다. 			ND_DD	Aaron Park	
							V	Opening Hours Communication	개점시간의 전달	Phone number of MB 24Hr emergency call has to be included in open hour board and 24Hr Dealer Roadside Assistance contact number can be added optionally.	개점시간은 웹페이지나 편지, 광고글등의 다중 채널 교류를통해 전달되어야 한다.			ND_DD	Aaron Park	
		ICE&EQ	B 1.1	Management & Organization	Management Structure & Organization	Basic Bonus		General Manager	General Manager	Each Dealer company has assigned the function of General Manager respectively responsible for overall performance of responsible dealerships.	각 딜러는 해당 딜러쉽을 총괄하여 관리할 수 있는 General Manager를 두어야 한다.	MPC	Overall	ND_BM	Aaron Park	
							I	Nomination of General Manager	General Manager 임명	Each Dealership has an officially assigned General Manger	각 딜러쉽은 공식적으로 임명된 General Manager 가 있어야 한다. 			ND_BM	Aaron Park	
							I-c	Non-conformance	불만족 시	In case of non-conformance, prior written approval by MBK exists. 	이를 만족하지 못한 경우에는, MBK 의 문서상 사전 승인을 득하여야 한다.			ND_BM	Aaron Park	
							II	Appointments to General Manager	General Manager 선임	New appointments to General Manager positions require prior communication and approval by MBK.  If required, MBK can request an assessment process such as interview and Dealer participates in the process actively. 	General Manager의 선임은 MBK와의 사전 논의 및 승인이 있어야 한다. 필요한 경우, MBK는 인터뷰 등의 심사절차의 진행을 요청할 수 있으며, 딜러는 이에 적극적으로 부응한다.			ND_BM	Aaron Park	
							III	Individual Development Plan for key managers	각 General Manager의 개발 계획	An individual development plan exists for all General Manager and this includes active participation in the Certified management program organized by MBK.	모든 General Manager는 개인별 계발 계획이 있어야 하며, C-management 등 MBK 교육 프로그램에 적극적인 참여 계획을 포함한다.			ND_BM	Aaron Park	
							IV	Development Plan	개발 계획	The individual development plan for General Managers includes active participation in the Certified management program provided/organized by MBK. 	General Manager의 개별 계발 계획은 C-management 등 MBK가 제공하는 교육프로그램에 적극적으로 참여할 것을 포함한다.			ND_BM	Aaron Park	
		ICE&EQ	B 1.12	Management & Organization	Management Structure & Organization	Basic Bonus		Product Expert	프로덕트 엑스퍼트	Each Showroom has assigned Product Expert for vehicle description, test drive and handover. 	각 전시장은 차량 설명, 시승 및 출고를 위한 Product Expert를 두어야 한다.	MPC	Overall	ND_DD	Aaron Park	
							I	Product Expert Hiring	프로덕트 엑스퍼트 고용	Each showroom employs and maintains a minimum number of Product Expert. The minimum number of employees is based on one Product Expert per 15 sales consultants during six months on average for each showroom. (Rounding up more than 15 sales consultants)	각 전시장에는 Product Expert 최소 인원 이상을 고용하고, 유지한다. 최소 인원은 각 전시장 별 6개월 평균 영업사원 수 15명 당 1인을 기준으로한다. (15명이상일 경우 반올림)			ND_DD	Aaron Park	
							II	Training Result of Product Expert	프로덕트 엑스퍼트 교육 결과	Product Expert should obtain average scores 90 or more (out of 100) in the knowledge test conducted under defined Job Profile/Product Training at Mercedes-Benz Training Academy.	Product Expert는 Mercedes-Benz Korea Training Academy에서 시행되는 지식 평가에서 평균 90점 이상을 받아야 한다.
 
			Training	Jennifer Kim	
							III	Product Expert Work	프로덕트 엑스퍼트 업무	Product Expert at each showroom shall be employed as a full-time employee to provide customers with vehicle test drive and handover services at all times.	각 전시장의 Product Expert는 정규직으로 고용되어 항시 원활한 차량 시승 및 출고 서비스를 고객에게 제공하여야 한다.			ND_DD	Aaron Park	
							III-b	Non-conformance	불만족 시	In case of non-conformance, prior written MBK approval exists after discussion with MBK.	만족하지 않을 시, MBK와의 사전 협의를 통하여 문서상 사전 승인을 득해야 한다.			ND_DD	Aaron Park	
		ICE&EQ	B 1.16	Management & Organization	Management Structure & Organization	Basic Bonus		Fleet Key Account Manager	Fleet Key Account Manager	Each dealers must have a C-Sales certificated (or upon agreement with MBK)  full-time Fleet Key Account Manager for Mercedes-Benz Fleet business. 

If more efficient fleet business management is necessary, assigning a Fleet manager is recommended.
	각 딜러사는 메르세데스-벤츠 Fleet Sales 사업을 위해 반드시 C-sales 자격증을 보유한 (또는 MBK와 협의 가능)  풀타임 Key Account Manager 를 보유하여야 한다. 

보다 효율적인 Fleet sales 사업 관리가 필요할 시 별도로 Fleet Manager 를 지정하기를 권장한다.
	MPC	Sales	Sales_F&U	Min-Seop Rho 	
							I	- Appointments to Fleet Key Account Manager (or Fleet Manager).
- Qualification & work guide for Key Account Manager & Fleet Manager	− Fleet Key Account Manager 혹은 Fleet Manager의 임명
− Fleet key Account Manager 혹은 Fleet Manager의 자격요건 및 업무 지침	New appointments of Fleet Key Account Manager (or Fleet Manager) must be informed to MBK in advance. If required, MBK can request an assessment process such as interview and Dealer participates in the process actively.
In the case of resignation of existing Key Account manager, the dealer must appoint a new Key Account manager within three months.
For Fleet Key Account Manager & Fleet Manager's qualifications and work guide, refer to the separate guideline which is officially distributed from Fleet & Used Car team.
	Fleet Key Account Manager (또는 Fleet Manager)의 선임은 MBK에게 사전 고지되어야 한다. 합리적으로 필요한 경우, MBK 는 인터뷰 등의 심사절차의 진행을 요청할 수 있으며 딜러는 이에 적극적으로 부응한다.
기존 Key Account manager 퇴사의 경우, 딜러사는 3개월이내 새로운 Key Account manager를 임명해야 한다. 
Fleet Key Account Manager 및 Fleet Manager의 자격 요건 및 업무 가이드는 Fleet & Used Car팀에서 별도로 배포하는 가이드라인을 참조한다.			Sales_F&U	Min-Seop Rho 	
15.0		ICE&EQ	B 1.2	Management & Organization	Management Structure & Organization	Must		Sales and After-Sales Manager	Sales Manager와 After-Sales Manager	Each dealership has assigned the function of a Sales Manager and After-Sales Manager and parts responsible respectively responsible for Mercedes-Benz sales, service and parts business. 	각 딜러는 메르세데스-벤츠 영업, 서비스, 그리고 부품 사업을 위한  Sales Manager 와 After-Sales Manager 그리고 부품 담당자 를 두어야 한다. 	MPC	Overall	S&M / CS	Sales/CS Area Managers	
							I	Appointments of Sales Manager and After-Sales Manager 	Sales Manager와 After-Sales Manager 임명	New appointments of Sales Manager and After-Sales Manager positions are informed to Mercedes-Benz Korea. If required, MBK can request an assessment process such as interview and Dealer participates in the process actively. 	신임 Sales Manager 와 After-Sales Manager의 선임은 MBK에게 사전 고지되어야 한다. 합리적으로 필요한 경우, MBK는 인터뷰 등의 심사절차의 진행을 요청할 수 있으며, 딜러는 이에 적극적으로 부응한다.			S&M / CS	Sales/CS Area Managers	
							II	Individual Development Plan for key managers exists	핵심 매니저의 개발 계획의 유무	An individual development plan exists for all key managers such as Sales Manager and After-Sales Manage, and it includes active participation in the training program provided/organized by MBK. 	Sales Manager 나 After-Sales Manager와 같은 핵심 매니저들은  개별 계발 계획이 있어야 하며, MBK가 제공하는 교육프로그램에 적극적으로 참여할 것을 포함한다.			S&M / CS	Sales/CS Area Managers	
							III-a	Nomination of Sales Manager	Sales Manager의 임명	Each Dealership has an officially assigned Sales manager.	각 딜러쉽에는 공식적으로 임명된 Sales Manager가 있어야 한다. 			S&M / CS	Sales Area Managers	
							III-b	Assigned After-Sales Manager and Parts Manager	After-Sales Manager와 부품 담당자의 존재 유무	Each Dealership has an officially assigned After-Sales and Each Service Center has an officially assigned Parts Responsible.	각 딜러쉽에는 공식적으로 임명된 After-Sales Manager와 각 서비스센터는 부품 담당자 각각 존재한다. 			S&M / CS	CS Area Managers	
							III-c	Non-conformance	불만족 시	In case of non-conformance, a prior agreement with Mercedes-Benz Korea is required.	만족되지 않을 시, Mercedes-Benz 와 사전 협의를 거쳐야 한다.			S&M / CS	Sales/CS Area Managers	
		ICE&EQ	B 1.20	Management & Organization	Management Structure & Organization	Basic Bonus		Used Car Manager & Purchasing Manager	Used Car Manager & Purchasing Manager	Each dealership must assign full-time Used Car Manager & Purchase Manager separately responsible for Mercedes-Benz Used Car business.	각 딜러십(전시장)는 메르세데스-벤츠 중고차 사업을 위해 공식적으로 임명한 풀타임 Used Car Manager와 Purchasing Manager를 각각 두어야 한다.	MPC	Sales	Sales_F&U	Sung-Min Kim	
							I	Appointments to Used Car Manager & Purchasing Manager	Used Car Manager 및 Purchasing Manager의 선임	New appointments to Used Car manager & Purchasing manager are informed to Mercedes-Benz Korea. If required, MBK can request an assessment process such as interview and Dealer participates in the process actively. Both Used Car manager and Purchasing manager must meet eligibility.	Used Car Manager 및 Purchasing Manager의 선임은 MBK에게 사전 고지되어야 한다. 합리적으로 필요한 경우, MBK 는 인터뷰 등의 심사절차의 진행을 요청할 수 있으며 딜러는 이에 적극적으로 부응한다.Used Car Manager와 Purchasing Manager는 모두 MBK 에서 배포한 자격요건에 맞아야 한다.			Sales_F&U	Sung-Min Kim	
		ICE&EQ	B 1.22	CPO Sales	Sales Process
CPO Sales 	Basic Bonus		Sales Monitoring & Report	세일즈 모니터링 및 리포트	The dealer sets targets and regularly monitors performance of each salesperson. Appropriate action should be taken by the management in order to meet cpo sales objectives.	딜러는 개별 (또는 팀별) 판매 목표량을 정하고 각 영업사원의 성과를 정기적으로 살핀다. 인증중고차 판매 목표를 달성하기 위해 관리부는 적절한 조치를 취해야 한다.	MPC	Sales	Sales_F&U	Sung-Min Kim	
							I-a	Sales performance records	세일즈 퍼포먼스 기록	Actual records (Monthly Closing Report) must be provided to responsible cpo manager including monthly qualified trade-in / conquest results.	딜러는 담당 cpo manager에게 월 단위로 monthly closing report를 제출하며, 여기에는 조건에 부합하는 trade-in / non-MB Trade-in 결과와 매입배율 관리에 대한 현황이 포함되어야 한다.			Sales_F&U	Sung-Min Kim	
							I-b	Non-conformance	불만족 시	In case of non-conformance, a prior agreement with Mercedes-Benz Korea is required.	만족되지 않을 시, Mercedes-Benz 와 사전 협의를 거쳐야 한다.			Sales_F&U	Sung-Min Kim	
16.0		ICE&EQ	B 1.3	Management & Organization	Management Structure & Organization	Basic Bonus		Retail HR Database Management	임직원 현황표 관리	The Dealership‘s organization and functions with corresponding responsibilities are documented in an organization chart and are accessible for everyone in the Dealership.	딜러 조직도에 각 직무별 기능 및 책임 분야가 정리되어 있어야 하며 모든 직원들이 쉽게 접근할 수 있다. 	MPC	Overall	ND_DD	Aaron Park	
							I	Names and Functions of Staff 	임직원 현황표	Organization chart covers all positions (including at least management level, productive employees, service advisors) and all staff's names are associated with each function.	딜러 조직도 및 임직원 현황표는 최소한 관리자, 직접 작업자 및 서비스 어드바이저등을 포함한 모든 직급을 포함하여야 하고 모든 직원의 이름에 각자의 담당업무가 포함되어야 한다.			ND_DD	Aaron Park	
							II	Organization Chart Information	조직도의 내용	The Dealer shall follow the guideline provided by MBK and fill in the most accurate and latest information including new hire/resignation/internal rotation.	딜러사는 MBK에서 배포한 임직원 현황표 및 조직도 가이드라인을 준수하여, 신규입사/퇴사/보직이동 등과 관련된 최신의 정보를 정확히 기입하여야 한다. 			ND_DD	Aaron Park	
							III	Update of organization chart	조직도 업데이트	The company's Organization Chart and employee directory shall be uploaded and maintained in BENEFIT every month within working day 5 days by MBK with the up-to-date information. The information complies with guideline and template which is provided by MBK.	딜러 조직도 및 임직원 현황표는 전월 기준으로 MBK가 제공하는 가이드라인과 템플렛에 따라 익월 제5영업일 내에 BENEFIT을 통해 업로드되고 관리되어야 하며, 최신 정보여야 한다. 			ND_DD	Aaron Park	
							IV	Accuracy	조직도의 정확성	Retail HR data should be accurate. In case, the Dealer in need of revising uploaded information, MBK can request for additional submission or correction. The dealer shall submit additionally requested information within 3 working days from the requested date.	업로드된 임직원 현황표 정보는 정확해야한다. 업로드 된 자료의 정정이 필요한 경우, MBK는 추가 제출을 요구할 수 있다. 추가 제출 요청을 받을시, 요청시점으로 부터 제 3영업일 내에 정정, 재제출 해야 한다. 			ND_DD	Aaron Park	
		ICE&EQ	B 2.10	Management & Organization	Business Management & Controlling	Basic Bonus		Fidelity obligation	충실도의 임무	Dealers is obligated to follow policy defined by MBK in dealer contract, retail policy, guideline and direction notified to dealers through written document and official letter including e-mail.	딜러는 서면 또는 공문 (이메일 포함)을 통해 배포된 MBK와의 딜러 계약서(Dealer Agreement)과 소매 영업 정책 (Retail Policy) 및 각종  가이드라인과 지침에 대해 성실히 이행하여야 한다.	MPC	Overall	ND_BM	Sora Kim	
							I	Warning letter	경고장	If the Warning letters approved by network development and department head or above of requesting department are sent to a same dealership twice or more per year due to violation of any policy defined by MBK.	MBK 규정사항을 위반하여 해당부서의 부사장 급 이상과 네트워크 개발부의 승인을 득한 경고 공문이 동일한 딜러쉽에 연 2회 이상 발송된 경우 미충족 처리한다.			ND_BM	Sora Kim	
17.0		ICE&EQ	B 2.1	Management & Organization	Business Management & Controlling	Must		Accounting System	회계 시스템	The dealer operates with a designated accounting software (DMS) based on Korea International Financial Reporting Standard (K-IFRS) or Korea Generally Accepted Accounting Principles (K-GAAP).	딜러의 회계는 지정된 회계 소프트웨어(DMS)를 사용하며, 회계 기준은 한국채택국제회계기준(K-IFRS) 또는 일반기업회계기준(K-GAAP)으로 한다.	MPC	Overall	ND_BM	Sora Kim	
							I	Accounting supported by accounting software	회계 소프트웨어 기반의 회계 관리	The dealer operates with DMS accounting module in principle, based on the Korea International Financial Reporting Standard (K-IFRS) or Korea Generally Accepted Accounting Principles (K-GAAP).	딜러사는 DMS를 회계 시스템으로 사용하는 것이 원칙이며, 회계 처리 기준은 한국채택국제회계기준(K-IFRS) 또는 일반기업회계기준(K-GAAP)으로 한다.			ND_BM	Sora Kim	
							II-a	Integrated accounting system	통합 회계 시스템	The accounting system is integrated in DMS or has a suitable interface to DMS.
	회계시스템은 DMS에 통합되거나 DMS와 호환되어야 한다.			ND_BM	Sora Kim	
							II-b	Non-conformance	불만족 시	In case of non-conformance, prior written MBK approval exists.	만족되지 않을 시 Mercedes-Benz Korea 의 문서상 사전 승인을 득하여야 한다. 			ND_BM	Sora Kim	
19.0		ICE&EQ	B 2.2	Management & Organization	Business Management & Controlling	Must		Format of Reporting Data	보고자료의 형식	The reporting data as defined in the MB Dealer Reporting Structure is provided electronically (e.g. via Internet) in an adequate interfacing format defined by MBK.	MB 딜러 보고 구조에 맞는 보고자료는 MBK에서 정의하는 시스템 인터페이스에 부합하는 형식으로 제출된다.	MPC	Overall	ND_BM	Sora Kim	
							I	Integrated accounting system	통합 회계 시스템	Kerridge Autoline DMS linked to MBK DMS server is in place and in use for daily operation. 	MBK DMS server 에 연결된 Kerridge Autoline DMS 가 설치되어 일일 업무에 사용되고 있다. 			ND_BM	Sora Kim	
							I-b	Non-conformance	불만족 시	In case of non-conformance prior written approval by MBK exists. 	만족하지 않을 시 Mercedes-Benz Korea의 문서상 사전 승인을 득하여야 한다. 			ND_BM	Sora Kim	
							II	Input data via DMS	DMS를 통한 데이터 입력	The Dealership has an automatic interface in the DMS and provides input date in Dealer Reporting Structure defined by Mercedes-Benz Korea. 	딜러는 DMS 에 연결되어 있고, Mercedes-Benz Korea 에서 요구하는 딜러 보고구조에서 정의하는 입력정보를 모두 입력한다. 			ND_BM	Sora Kim	
							II-b	Non-conformance	불만족 시	In case of non-conformance prior written approval by MBK exists. 	만족하지 않을 시 Mercedes-Benz Korea 의 문서상 사전 승인을 득하여야 한다. 			ND_BM	Sora Kim	
							III-a	Accounting System with DMS	DMS를 통한 회계 시스템 관리	DMS accounting module is used and Dealership provides data through DMS.	딜러는 DMS 회계 모듈을 사용하여야 하며, DMS 시스템을 통해 자료를 제출한다.			ND_BM	Sora Kim	
							III-b	If not available	불가능할 시	If such set-up of automated data transfer is not available, or the financial data of DMS module does not fit for Mercedes-Benz Korea's requirements, Dealer shall submit such information with designated format to Mercedes-Benz Korea. 	DMS와의 연결이 안되어 있거나, 혹은 연결은 되어 있으나 DMS 상의 정보가 Mercedes-Benz Korea에서 요구하는 정보에 부합하지 않을 경우, 딜러는 해당 자료를 지정된 양식으로 Mercedes-Benz Korea로 제출하여야 한다.			ND_BM	Sora Kim	
20.0		ICE&EQ	B 2.3	Management & Organization	Business Management & Controlling	Must		Statutory Financial Statement	연간회계감사자료	The statutory balance sheet and the income statement relating to the brand is submitted to MBK.	연간회계감사자료(재무재표 및 손익계산서)가 MBK에 제출되어야 한다. 	MPC	Overall	ND_BM	Sora Kim	
							I	Financial statement	재무 제표	The statutory financial statement of the contract partners is available at MBK within 120 days after each fiscal year.	연간회계감사자료가 회계년도 후 120일 이내에 Mercedes-Benz Korea 에 제출되어야 한다. 			ND_BM	Sora Kim	
							II	Financial & operating income statement	재정 및 경상비 손익 계산서	Dealer provides the relevant data for the credit audit under MBK guideline upon the request from MBK.	딜러사는 MBK의 요구가 있을 시 연간 신용평가에 필요한 자료를 제공한다. 			ND_BM	Sora Kim	
21.0		ICE&EQ	B 2.4	Management & Organization	Business Management & Controlling	Basic Bonus		DMS Maintenance	DMS 관리	Dealer shall assign the responsible personnel for each module and manage the system in conformity with the standard guideline for proper usage of DMS.	딜러는 DMS의 올바른 사용을 위해 담당자를 지정하고 기준에 맞게 관리한다.	MPC	Overall	ND_BM	Sora Kim	
							I	Standard Chart of Account and monthly closing	회계 관련 표준 차트 및 월마감	The dealer operates with DMS accounting module based on the Standard Chart of Account(COA) provided by MBK and closing of DMS accounting module shall be completed within the specific timeframe defined by MBK.	딜러사의 DMS 상 회계 모듈 사용은 MBK가 규정한 표준회계계정 (CoA)에 따르며, 월마감은 MBK가 정의한 기한 내에 완료한다.			ND_BM	Sora Kim	
							II	Monthly closing of DMS accounting module	DMS 회계모듈의 월마감	Closing of DMS accounting module shall be completed within the specific timeframe defined by MBK.	DMS 회계모듈의 월마감은 MBK가 정의한 기한 내에 완료한다. 			ND_BM	Sora Kim	
							II-b	Non-conformance	불만족 시	In case of non-conformance a prior written approval of Mercedes-Benz Korea Ltd. exits.	만족하지 않을 시 Mercedes-Benz Korea의 문서상 사전 승인을 득하여야 한다.			ND_BM	Sora Kim	
							II-a	Process owner for each DMS module assigned 	모듈 별 별도의 담장자 임명	Dealer shall designate the responsible person for each DMS module for proper maintenance of DMS data, and the designated person for each module shall be named in employee directory and organization chart, respectively.	DMS 데이터의 적절한 관리를 위하여 딜러는 각 DMS 모듈 별 별도의 담당자를 지정하여야 하며, 이를 임직원 현황표 및 조직도에 반영하여야 한다.			ND_BM	Sora Kim	
							II-b	Process owner for each DMS module trained	모듈 별 담당자의 교육	The responsible person of each module shall actively attend the relevant training offered by MBK and obtain evaluation result at a certain level.	각 모듈 별 담당자는 MBK가 제공하는 관련 교육에 충실히 참여하여야 하며, 일정 수준의 평가 결과를 득한다.			ND_BM	Sora Kim	
		ICE&EQ	B 4.01	Management & Organization	IT Facilities & Operations	Basic Bonus		Connectivity for IT system	IT 시스템을 위한 연결성	The IT systems of the dealership fulfil the brand requirements and are linked to that of the MBK (where necessary) to assure required connectivity (transmission), as well as the accuracy and timeliness of the database content.

	딜러쉽의 IT 시스템은 브랜드 요구를 중족해야하며 데이터 배이스 컨탠츠가 정확하게, 시간제약 없이 통신 될 수 있어야 한다.	MPC	Overall	ND_DD	Aaron Park	
							I	Connection	연결	IT system of the dealership is linked to DMS of MBK 	딜러쉽의 IT 시스템은 DMS 에 연결되어 있어야한다.			ND_DD	Aaron Park	
							II	Wi-Fi	와이파이 	Wi-Fi connection available  Incl. guest wi-fi for customers	고객용을 포함한 Wi-Fi 연결이 가능해야 한다.			ND_DD	Aaron Park	
							III	Maintanence of Digital elements	Digital 요소 관리	The digital elements in showroom and service center are working and managed well.
- MPS II: Digital Signage, Digital Kiosk

- MAR 2020(Including Scala Software):
Display area : Stage wall 
Consulting area : Digital signage with mirroring function
Consulting room : Digital signage, brand signage
Vehicle handover : Digital signage, recommended sound system	매장에 비치된 Digital 요소들의 관리가 잘 이루어지고 있다. 
- MPS II: Digital Signage, Digital Kiosk

- MAR 2020(Scala 포함):
Display area : Stage wall 
Consulting area : Digital signage with mirroring function
Consulting room : Digital signage, brand signage
Vehicle handover : Digital signage, recommended sound system			ND_DD	Aaron Park	
24.0		ICE	C 1.1	Personnel & Training	Human Resources Management	Must		Sales Staff Qualification	전시장 임직원 자격 요건	Mercedes-Benz Retail Sales staff should participate qualification and certification program of Mercedes-Benz Korea Training Academy.	Mercedes-Benz 차량 판매에 종사하는 임직원은 Mercedes-Benz Korea Training Academy에서 주관하는 교육 및 인증 프로그램에 참가한다.	MPC	Sales	Training	Jennifer Kim	
							I-a	New Car Sales Staff	신차 전시장 임직원	1) All Sales Consultants in Showroom should participate in C-Sales training at Mercedes-Benz Korea Training Academy as guided by ""Retail Career Management Program"" and complete its certification process within 12 months after the training.
