,Doc ID,Parent ID,Custodian,Ori File Folder,Ori File Name,S - Created Date,S - Modified Date,Sent Date,From,From SMTP,To,To SMTP,CC,CC SMTP,BCC,BCC SMTP,Last Author,Author/Sender,Content,TxT File Path
0,147751,147751.0,세진 김,\공유폴더\O Drive\CS\CS Marketing\08. Dealer Steering & Policy\Dealer Standards\2022\2022 Dealer Standard,Change Request 2022_Dealer Standards Catalogue_MKT+Digital.xls,2011-09-16 14:29:46,2021-08-20 10:14:05,1900-01-01,,,,,,,,,"Ku, Jaeun (691)","lee, Matthew","﻿DS update Guideline


	Dealer Standards Catalogue	
	2022.0	
	Revision Guide - 업데이트 가이드	
I. Timeline for 2022 Dealer Standards Catalogue 	
	« Current version review & send updated version to ND (Including Legal Review)	« By 20th August. 2021	
	Feasibility check & Adjustment	By 8th. September. 2021	
	Final confirmation by BU 	By 22th. September. 2021	
	Distribution to dealers	By 29th. September. 2021	
II. Notice	
II-1.	Please kindly follow the rule described below.	
	Insertion (newly added content)	Blue	
	Modification	Green	
	Deletion	Red	
	   * contents to be deleted should be marked in red but not eliminated directly from the body. 	
	   * 삭제되는 내용은 반드시 내용을 바로 삭제하지 말아주시고, 빨간색으로 줄그어 표기 부탁 드립니다.	
	[Example]	
Mercedes-Benz Korea Ltd.	DS update Checklist


Dealer Standards Catalogue	
2022.0	
Checklist 체크리스트	
딜러 스탠다드 항목은 아래와 같은 사항이 고려되어야 합니다. 딜러 스탠다드 카달로그 제출 전, 아래 Checklist를 반드시 표기하신 후 제출하여 주시기 바랍니다.
Please kindly following considerations for the Dealer Standards Items. Please make sure to mark the checklist below before submitting the dealer standard catalogue.	
		Category	No.	Checklist(Kor)	Checklist(Eng)	Yes	No	
	1.0	General	1.0	모든 항목은 측정/평가가 가능합니다.	All items can be measured or evaluated.	
			2.0	각 딜러쉽이 공정하게 평가 가능합니다.	Each dealership can be evaluated fairly.	
			3.0	새롭게 추가/개정된 항목은 법적 검토를 완료하였습니다.	The newly added/revised items have been completed legal review.	
			4.0	Outdated 된 내용은 삭제 혹은 개정되었습니다. 	The outdated items have been deleted or updated.	
	2.0	Awarded Bonus	1.0	각 부서에서 올해 특별히 추진하고자 하는 내용이 고려되었습니다.	The items have been considered that each department wants to pursue in 2021.	
			2.0	딜러사에서 추가적인 노력을 해야 보너스 달성할 수 있는 항목으로 구성되었습니다.	The dealer needs to make additional efforts to achieve the awarded bonus.	
			3.0	측정 혹은 평가가 가능한 항목으로 구성되었습니다.	All items can be measured or evaluated.	
			4.0	평가 방법이 단순하고, 이해하기 쉽습니다.	The evaluation method is simple and easy to understand.	
			5.0	Outdated 된 내용은 삭제 혹은 개정되었습니다. 	The outdated items have been deleted or updated.	2022 Dealer Standards


	 2022 Dealer Standards Catalogue	
	*Please mark the contents in the specified color.						Newly Added	Blue	
							Modification	Green	
							Deletion	Red	
	Market 
specific name	Business Sector	Category	Standard type	Column1	Short Title 
(ENG)	Short Title
(KOR)	Mercedes-Benz Korea Ltd.
Measurement Criteria (ENG)	Mercedes-Benz Korea Ltd.
Measurement Criteria (KOR)	Check
point	Activity	Dept.	Responsibility	
1.0	A 1.1	Brand Presence	Site & Buildings	Must		Development Site & Buildings	개발 부지 및 건물	The development of site and building is in accordance with long-term capacity requirements as agreed with Mercedes-Benz Korea in a separate agreement. 	부지와 건축물은 Mercedes-Benz Korea와의 별도 계약된 대로 장기적으로 요구되는 판매물량에 따라야 한다.	Back Office	Overall	ND_DD	Aaron Park	
					I-a	Individual Development Plan	개별적인 개발 계획	A site development plan of expansion, expansion & relocation, relocation, remodeling or new site is included in dealer development plan and signed under mutual agreement  between Dealer and Mercedes-Benz Korea.	확장, 확장이전, 이전, 리모델링, 새로운 전시장/서비스센터 오픈에 대한 개발계획이 딜러개발계획(DDP)에 포함되어 있고 양사 동의 하에 서명되어져야 한다.			ND_DD	Aaron Park	
					I-b	Completed or in progress	완료 혹은 진행 중	A site development plan of expansion, expansion & relocation, relocation, remodeling or new site is in progress or has been completed as it was agreed by MBK.	Mercedes-Benz Korea와 확장, 확장이전, 이전, 리모델링, 새로운 전시장/서비스센터 오픈에 대한 개발계획이 MBK와 협의된 일정대로 진행 중 혹은 완료되었다.			ND_DD	Aaron Park	
					II-a	Final Site Plan and Architectural Drawings	최종 부지 계획 / 건축 도면	A site development plan of expansion, expansion & relocation, relocation, remodeling or new site is in progress or has been completed as it was agreed by MBK.	사업계획, 위치, 스케줄이 포함된 확장, 확장이전, 이전, 리모델링, 새로운 전시장/서비스센터 오픈에 대한 최종 개발계획은 Mercedes-Benz Korea에 의해 서면으로 승인되어지며 해당 부지에 대한 도면은 Mercedes-Benz Korea에 의해 증명서로 승인되었다.	 		ND_DD	Aaron Park	
					III-a	Changes within functional layout design	기능적인 배치 디자인 상의 수정	The current status of the site and building is unchanged from the original site plan and architectural drawings that were approved by Mercedes-Benz Korea.	현 상태의 전시장/서비스센터의 위치나 건물이 최종승인을 득한 개발계획 및 도면과 일치한다.			ND_DD	Aaron Park	
					III-b	In case of non-conformance	불만족 시	If changes have been made to the site and building from the originally approved plan, there must be additional approval in writing by Mercedes-Benz Korea.	Mercedes-Benz Korea와  승인 이후 추가 변경이 있을 경우, 서면으로 추가 승인을 받는다.			ND_DD	Aaron Park	
2.0	A 1.2	Brand Presence	Site & Buildings	Must		Parking Lots	주차장	A sufficient number of function-related, signpost, illuminated and properly surfaced parking areas are available on site. 	안내표지와 조명시설이 된 기능적으로 충분한 수의 평평한 주차장이 있어야 한다.	Site	Overall	ND_DD	Aaron Park	
					I-a	Parking - Sales Customers	판매 고객 주차장	Minimum (Maga:20, Large:15, Medium:10, Small:8, Satellite:3) parking lots for sales customers are available on site in Showroom.	전시장의 경우, 신차 고객을 위한 최소한(Maga:20, Large:15, Medium:10, Small:8, Satellite:3)의 주차장이 현장에 있어야 한다.			ND_DD	Aaron Park	
					II-a	Parking - Demonstration Vehicles	시승 차량 주차장	Minimum (Maga:20, Large:15, Medium:10, Small:8, Satellite:3) parking lots for demo cars are available on site in Showroom.	전시장의 경우, 시승차 용도의 최소한 (Maga:20, Large:15, Medium:10, Small:8, Satellite:3) 의 주차장이 현장에 있어야 한다.			ND_DD	Aaron Park	
					III-a	Parking Lots Workshop Customers	워크샵 고객 주차장	Minimum (Number of Workbay x 2) parking lots for After-Sales customers are available on site in Service Center.	서비스센터의 경우, 서비스센터 고객을 위한 최소한(Workbay 수 x 2)의 주차장이 현장에 있어야 한다.			ND_DD	Aaron Park	
					IV-a	CI Conformance of Parking Lots	CI와 주차장의 일치 여부	All customer parking lots are brand CI/CD compliant marked and illuminated.	모든 고객 주차장은 MB CI/CD에 맞는 조명시설과 표지판이 있어야 한다.			ND_DD	Aaron Park	
					IV-b	Parking lot line	주차구역 표시선	The parking lot be marked with a clear parking area marking line.	모든 주차장에는 명확한 주차구역 표시선이 표기되어 있어야 한다.			ND_DD	Aaron Park	
					IV-c	If size or location differs	크기 혹은 위치 변경 시	If size or location differs, prior written MBK approval exists.	주차장의 면적이나 위치가 다를 경우 MBK의 사전 승인이 있어야 한다. 			ND_DD	Aaron Park	
	A 1.21	Brand Presence	Site & Buildings	Basic Bonus		Purpose & Utilization of New Car Storage	신차 보관소의 목적 및 사용	New Car Storage should be utilized only for the purpose of vehicle storage.	신차보관소는 오직 차량 보관 목적으로만 사용되어야 한다.	Site	Sales	ND_DD	Aaron Park	
					I	Approval for New Car Storage	신차보관소의 승인	If necessary, dealer can establish a new car storage facility in places other than the showroom and service center after obtaining MBK's approval. New car stocks can be delivered to the storage site.	딜러사는 필요한 경우 MBK의 승인을 득한 후 전시장 및 서비스센터 외의 장소에 신차보관소를 둘 수 있으며, 해당 주소지로 신차 재고를 배송받을 수 있다.			ND_DD	Aaron Park	
					II-a	Usage for New car storage	신차 보관소 용도	Any kind of brand exposure, sales, and marketing activities at New Car Storage are prohibited.	신차보관소는 일체의 브랜드 노출, 판매 행위, 마케팅 활동 등이 금지된다. 			ND_DD	Aaron Park	
					II-b	Security for New car storage	신차보관소의 보안	New car storage must be a facility suitable for vehicle storage and must be equipped with security facilities. (i.g. restricted area with access control, CCTV and etc.)	신차보관소는 차량 보관에 적합한 시설 이어야 하며, 보안 시설이 갖추어 져야 한다. (예. 출입 통제가 가능한 제한 구역, CCTV, 등)			ND_DD	Aaron Park	
					II-c	In case of non-conformance	불만족시	In case of non-conformance, approval for New Car Storage will be terminated immediately.	불만족시 신차 보관소에 대한 승인은 즉시 취소된다.			ND_DD	Aaron Park	
	A 1.22	Brand Presence	Site & Buildings	Basic Bonus		Charging station for Electronic Vehicle	전기차용 충전시설	A minimum amount of dedicated functional charging solutions is provided within the customer parking area	최소한의 충전 솔루션이 고객 주차 구역에 제공되어져야 한다.	Site	Overall	ND_DD	Aaron Park	
					I-a	Charging station	충전시설	All facility should have at least one charging station with 7.2kW.	모든 전시장과 서비스센터에는 적어도 1대 이상 7.2kW의 전기차 충전시설을 갖추고 있어야 한다.			ND_DD	Aaron Park	
					I-b	Providing charging station	충전시설 제공	For locations with Mercedes-Benz Passenger Cars Sales, charging solutions for customers can be shared. 
	메르세데스-벤츠를 위한 장소에서는 고객들을 위해 충전시설이 제공되어야한다			ND_DD	Aaron Park	
					I-c	Non-conformance	불만족 시	In accordance with Temporary/Stationary Differentiation the Standard Fulfillment can be suspended	일시적이거나 장소적인 차이에 따른 스탠다드 충족여부는 유예 될 수 있다.			ND_DD	Aaron Park	
					II	Daily check list	일일 관리대장	Maintenance of charging station should be included in the Daily check list.	전기차 충전 시설이 잘 관리 되도록 일일관리대장에 넣어 관리 하도록 한다.			ND_DD	Aaron Park	
3.0	A 1.5	Brand Presence	Site & Buildings	Must		Illumination of Outside Areas	외관 조명	The outside areas are illuminated according to brand retail formats.	외부는 MB Retail Format에 따라 조명이 되어야 한다.	Site	Overall	ND_DD	Aaron Park	
					I	Lighting	조명	The outlet has lighting to illuminate the showroom, parking lots, entrance, pylon, name panel (or facia), wall mounted & roof top star.	딜러는 전시장과 주차장, 입구, 파일런, 간판, wall mounted & roof top star에 조명장치를 하여야 한다.			ND_DD	Aaron Park	
					II	Night Illumination pylon	야간 조명 파일론	Exterior signages are illuminated in the night at least until 12.00 a.m.	외부사인물은 야간에 적어도 자정까지는 조명을 켜놓아야 한다.			ND_DD	Aaron Park	
					III	Night Illumination 	야간 조명	The showroom is illuminated in the night at least until 12.00 a.m.
	전시장은 야간에 적어도 자정까지는 조명을 켜놓아야 한다.			ND_DD	Aaron Park	
4.0	A 1.6	Brand Presence	Site & Buildings	Basic Bonus		Availability of CI/CD Recognition Points	건물 상태와 청결정도	All buildings are in a good state of repair with good visual appearance. Maintenance program is in place.	모든 빌딩은 외관과 관리상태가 좋아야 한다. 정비 계획이 있어야 한다.	Site	Overall	ND_DD	Aaron Park	
					I	Maintenance Program	유지 프로그램	A maintenance program regarding the visual appearance for the interior and exterior (including the grounds) is included in dealer development plan with confirmation of content and schedule by Mercedes-Benz Korea.	건물 내외부(바닥 포함) 관한 정비 계획이 딜러개발계획(DDP)내에 반영되고 Mercedes-Benz Korea에 그 내용과 일정이 협의되어 승인되어 진다.			ND_DD	Aaron Park	
					II	Maintenance Report	유지 보고서	A maintenance program has been executed on schedule according to dealer development plan, and the update of dealer development plan is reported to Mercedes-Benz Korea.	이 정비 계획이 Mercedes-Benz Korea와 협의된 계획에 따라 수행되고 있으며 수행 내용이 딜러개발계획내에 반영되어 Mercedes-Benz Korea에 보고 되어진다.			ND_DD	Aaron Park	
					III	Dedicated Person - Maintenance of the Building	건물 관리 담장자	A dedicated person assigned by the dealer management team is being responsible for the maintenance of the building to ensure that all buildings are in good state of repair.(Possible to hold an additional post)	모든 건물이 잘 유지 보수되도록 딜러의 관리팀에서 지정한 전담 직원이 건물 정비를 담당한다. (겸임가능)			ND_DD	Aaron Park	
					IV	Cleaning Contract	청소 계약	A cleaning program including contract with cleaning company is in place with a regular record of execution.	청소 용역 업체와의 내 외부 청소 계약서가 존재하고 청소 용역 업체에 의한 정기적인 청소 실행 기록이 있어야 한다.			ND_DD	Aaron Park	
					V	Cleanness of Buildings	건물(들)의 청결도	The buildings & facilities are clean:
- Interior: floor, ceiling,  reception desk, image walls, customer meeting room, customer lounge, washrooms, signage, collection cabinet, Promotion material(poster, banner, etc), vehicle specification board, etc.
- Exterior: MB & dealer name panel, pylon, facade, roof-overhang, flags, external signage, entrance, opening hour board, carpet, and the surroundings
- When raining: an umbrella stand near entrance	매장 내외부가 깨끗하게 유지되고 있다.
- 내부: 바닥, 천장, 리셉션 데스크, 이미지 월, 고객 상담실, 고객 휴게실, 화장실, 안내표시판, 컬렉션 케비넷, 프로모션 관련 자료 및 배너, 차량 제원판(전시장만 해당) 등.
- 외부: 간판, 파일런, 건물 앞면 유리상태, 지붕처마(roof-overhang), 깃발, 외부 방향지시판, 주 출입구, 영업시간 안내판, 주 출입구 카펫트, 건물 주변 등
			ND_DD	Aaron Park	
6.0	A 2.1	Brand Presence	Corporate Identity	Must		CI - Interior Architecture	CI - 실내 설계	The interior CI-design meets the brand requirements in terms of function, location and visual appearance in customer contact areas.	실내 CI 디자인은 고객 접촉 지역에서 기능과 위치, 외관 면에서 브랜드의 요구를 만족한다.	Site	Overall	ND_DD	Aaron Park	
					I-a	Guideline	가이드라인	 The interior fulfilll guideline that MBK announce on Benefit.	도면승인시 MBK 에서 Benefit 에 고지한 CI/CD 가이드라인을 준수한다.			ND_DD	Aaron Park	
					I-b	Guideline for MAR 2020	MAR2020 가이드라인	In case of MAR 2020, the interior fulfill guideline that MBK provide for project and have to be pre-approved.	2019년도 이후 신규,확장 혹은 레노베이션을 하는 경우 MBK 에서 제공한 MAR 2020 가이드라인을 충족해야하며, 계획은 사전에 승인 받아야 한다.			ND_DD	Aaron Park	
	A 2.10	Brand 
Presence	Corporate
Identity	Basic Bonus		Mercedes-Benz Certified CI/CD	메르세데스-벤츠 인증중고차 CI/CD 	Each dealerships must cope with overall Dealer Standard criteria of corporate identity aligned with Network Development Guideline stating below business brand specification.	모든 딜러사의 중고차 사업부는 Mercedes-Benz 에서 규정한 Brand Identity 에 준하는 내외부 가이드라인을 준수해야 한다.	CPO Showroom	Sales	Sales_F&U	Sung-Min Kim	
					I-a	Mercedes-Benz Certified interior & exterior	메르세데스-벤츠 인증중고차 내,외관	All interior designs must follow guideline of Mercedes-Benz Certified logos and brand identity provided by MBK Used Car Business department. All exterior designs must follow, showrooms applicable for, mercedes-benz certified brand logo display upon the guidance of CI/CD-signage direction. 	모든 내부 인테리어는 메르세데스벤츠 인증중고사업부에서 제공하는  로고와 브랜드 형식을 따라야 하며 외부 역시 허용 가능한 전시장의 경우에 따라 외형 CI/CD 사인 규정을 준수해야 한다.			Sales_F&U	Sung-Min Kim	
					I-b	On-Site Inspection 	현장평가	All authorized mercedes-benz certified dealerships will be inspected with all brand inspection guidelines as to Network Development criterias specifically with A 1.6, A 2.1, A 2.10, A 2.2, A 2.3, A2.4	모든 딜러사에는 딜러스탠다드 항목 중 A 1.6, A 2.1, A 2.10, A 2.2, A2.3, A 2.4 항목에 대해 인증중고사업부 전시장 시행확인을 받을 수 있다.  			Sales_F&U	Sung-Min Kim	
					I-c	Non-conformance	불만족시	In case of non-conformance, a prior agreement with Mercedes-Benz Korea is required.	만족되지 않을 시, Mercedes-Benz 와 사전 협의를 거쳐야 한다.			Sales_F&U	Sung-Min Kim	
7.0	A 2.11	Brand Presence	Corporate Identity	Basic Bonus		CI - Document and Business card	CI - 영업용 서식	Document and Business card as far as produced by Dealers fulfill brand specific CI/CD requirements.	딜러가 제작하는 모든 영업용 서식은 브랜드 CI/CD 요구조건을 만족해야한다.	Site	Overall	ND_DD	Aaron Park	
					I	Business Cards Dealership Personnel	딜러십 임직원의 명함	Business cards of all dealership personnel fulfill MB CI/CD requirements.
	모든 딜러 직원의 명함은 MB CI/CD 요구조건을 만족한다.			ND_DD	Aaron Park	
					III	CI/CD Conform Sales Documents	CI/CD에 부합한 판매 관련 서류	Sales documents (oders, invoices, letterheads and etc.) fulfill MB CI/CD requirements.	영업용 서식 (견적서, 인보이스, 업무용 레터 등)은 MB CI/CD 요구조건을 만족한다.			ND_DD	Aaron Park	
9.0	A 2.2	Brand Presence	Corporate Identity	Must		CI - Interior Equipment	CI - 실내 장비	The interior CI equipment meets the current brand requirements in customer contact area according to CI program.	CI 프로그램에 따라 고객 접촉 지역 내의 실내 CI 장치는 현재 브랜드 요구사항을 만족한다.	Site	Overall	ND_DD	Aaron Park	
					I	Furniture in Customer Contact Area	고객과의 접점에 구비된 가구	The following pieces of furniture in customer contact area are according to current MB CI/CD compliant MPSII or MAR 2020). (supplied by the Mercedes-Benz authorized supplier or supplier that has better quality and capacity than authorized supplier) 
- Minimum MPSII requirement for customer contact area: Reception desk, customer consulting desk, louver wall
- Minimum MAR 2020 requirement for customer contact area: 
1) Welcome Area: Wall Element Reception, Reception Table(Pod), Front Office, Hospitality Counter
2) Consulting Area: Consulting Round Table with 3 Chairs, Sofa, Consulting Table High, Consulting room
3) Vehicle Handover: min. 34 sqm space for handover exit to street	고객접촉지역에 있는 가구들은 현행 MB CI/CD 요구사항에 부합하는 MPSII 혹은 MAR 2020 가구들이여야 한다. (MPSII 혹은  MAR 2020 은 MBK 승인을 득한 업체 또는  그 이상의 공급 능력 및 실적이 확인된 업체에 한해 제작 가능)  
- 고객 접촉 지역 MPSII 최소 설치 요소: Reception Desk, 고객 상담용 Desk, 루버월
- MAR 2020 최소 설치 요소: 
1) Welcome Area: Wall Element Reception, Reception Table(Pod), Front Office, Hospitality Counter
2) Consulting Area: Consulting Round Table with 3 Chairs, Sofa, Consulting Table High, Consulting room
3) Vehicle Handover: min. 34 sqm space for handover exit to street			ND_DD	Aaron Park	
					II	Product Presentation Means	차량 전시 방식	All product presentation means are compliant to MB CI/CD such as MPSII or MAR 2020 (supplied by the Mercedes-Benz authorized supplier or Qualified supplier that has better quality and capacity than authorized supplier). 
- MPSII minimum requirement for product presentation : back panel,  graphic board or brochure stand. (Minimum of 1 display vehicle per floor has to be equipped with the minimum requirement.)
- MAR 2020 minimum requirement for product presentation: Floor Zoning, Digital Information Stand	차량 전시 공간은 현행 MB CI/CD 요구사항에 부함하는 MPSII 혹은 MAR 2020 요소로 구성되어야 한다.  (MPSII 또는 MAR 2020은  MBK 승인을 득한 업체 또는  그 이상의 공급 능력 및 실적이 확인된 업체에 한해 제작 가능) 
- MPSII 최소설치요소: back panel, graphic board 또는 brochure stand (전시장 각 층의 차량 1대 이상이 최소 설치요소를 만족해야 한다.)
- MAR 2020 최소 설치 요소: Floor Zoning, Digital Information Stand			ND_DD	Aaron Park	
					III		디지털 요소	In case of MAR 2020 showroom, digital elements which is compliant with MAR 2020 guide should be placed and pre-approved by MBK.
Welcome area : Digital signage or Kiosk
Display area : Stage wall 
Consulting area : Digital signage with mirroring function
Consulting room : Digital signage, brand signage
Vehicle handover : Digital signage, recommended sound system	MAR 2020 전시장의 경우, 가이드에 맞는 디지털 요소들을 배치하여야 하며, 해당계획을 사전에 MBK의 승인 받아야 한다.
Welcome area : Digital signage or Kiosk
Display area : Stage wall 
Consulting area : Digital signage with mirroring function
Consulting room : Digital signage, brand signage
Vehicle handover : Digital signage, recommended sound system			ND_DD	Aaron Park	
					IV		불만족 시	In case of non-conformance, hand in an individual development plan to MBK and it is included in DDP.	위의 사항을 만족하지 않을 시, 개발 계획을 DDP 에 포함하여 MBK에 제출하여야 한다.			ND_DD	Aaron Park	
10.0	A 2.3	Brand Presence	Corporate Identity	Basic Bonus		CI - Clothing & Name Badges	CI - 복장 및 이름표	In order to ensure that CI/CD principles are adhered to, uniform dress code and CI/CD compliant name badges should be adopted.	CI/CD 원칙이 고수되기 위해, 통일된 dress code와 CI/CD에 맞는 이름표를 착용한다.	Site	Overall	ND_DD	Aaron Park	
					I	CI/CD Conform Personnel Clothing	CI/CD에 부합한 임직원의 복장 상태	Service advisors and Mechanics in workshop have to wear clothing according to MB CI/CD and Personnel working in customer contact areas(Reception Area) wear clothing according to MBK recommendation.
 (Men: Black or dark color suit , White shirt, neat tie, Black or dark color business shoes, MB badge / Women: Black or dark color formal dress, bright shirt & MB badge)
(Product Expert: Uniforms recommended by MBK, dark color pants, sneakers or business shoes. Align with all PEs who are working in one showroom.)	서비스 어드바이저와 작업자는 MB CI/CD에 맞는 복장을 착용해야 하며,  판매 및 기타 고객응대 지역(Reception Area)에서 근무하는 직원은 MBK에서 권장하는 복장을 착용한다. (남성 : 검은색 정장, 하얀 셔츠, 깔끔한 넥타이, 검은색 or 어두운 색 계열의 비지니스 슈즈, MB 뱃지 /여성 : 검은색 or 어두운색 계열의 정장, 밝은 셔츠, MB 뱃지) 
(Product Expert: MBK에서 권장하는 상의 유니폼, 어두운 색 계열의 하의, 단정한 스니커즈 혹은 비지니스 슈즈 착용. 한 전시장에서 근무하는 PE의 경우 복장을 통일.)			ND_DD	Aaron Park	
					II-a	CI/CD Conform Name Badges	CI/CD에 부합한 이름표	All employees at customer contact area should wear name badges fulfilling MB CI/CD. 	고객 접촉지역의 모든 직원은 MB CI/CD를 따른 이름표를 착용하고 있어야 한다.			ND_DD	Aaron Park	
					II-b	MAR 2020 Showroom & Service center	MAR 2020 전시장 및 서비스센터	For MAR 2020 showrooms or service centers, nameplates and business cards should not be placed on the desk.	MAR 2020 전시장 혹은 서비스센터의 경우 MB CI/CD에 따라 명패 및 명함이 책상 위에 비치되지 않아야 한다. 			ND_DD	Aaron Park	
					III	Seasonal exception	계절에 따른 예외 사항	Comportable clothing (e.g. no tie, no jacket, short sleeve shirt) can be applied exceptionally in Summer season, from June to August.	여름기간 한정으로 (6월 ~8월) 좀 더 가벼운 복장 (넥타이 미착용, 자켓 미착용, 반팔 셔츠등)이 예외 적으로 허용 된다.			ND_DD	Aaron Park	
